{
  "id": "KU-ARC-015",
  "domain": "ARC",
  "subtopic": "住宅單元與類型",
  "type": "value_range",
  "title_zh": "單面住宅房間的有效進深帶",
  "title_en": "single-sided room depth for layout study",
  "summary_zh": "單面採光住宅主要房間可先以約 5–7 m 的淨進深作平面測試，並依窗高與遮擋重新計算。 若整個翼身達 8–9 m，服務帶位置便會決定室內深處是否仍有足夠日光。 房間深度與建築翼深不可互換。",
  "key_points_zh": [
    "核心主張：單面採光住宅主要房間可先以約 5–7 m 的淨進深作平面測試，並依窗高與遮擋重新計算。",
    "量測檢查：在平面與剖面量窗面到房間最深使用點，按各用途分別做 daylight check。"
  ],
  "evidence": {
    "strength": "NORMATIVE_PRACTICE",
    "findings": [
      {
        "claim_zh": "單面採光住宅主要房間可先以約 5–7 m 的淨進深作平面測試，並依窗高與遮擋重新計算。",
        "effect_or_value": "約 5–7 m 淨進深；待逐室採光驗證",
        "study_design": "跨地域設計參照綜整；數值狀態依 claim_verification 註記",
        "context_region": "跨地域；用途與當地法規需分開核驗",
        "library_id": "CIRCADIAN_DAYLIGHT20",
        "locator": "article; abstract/title scope only",
        "claim_verification": "CANONICAL_CROSS_CHECKED_CLAUDE_20261008"
      }
    ]
  },
  "values": [
    {
      "name": "single-sided room depth screening band",
      "range": "約 5–7 m 淨進深；待逐室採光驗證",
      "unit": "m",
      "context": "地區：跨地域；研究情境有限；用途：住宅主要房間初期排布；不作採光門檻；出處：Applicability of a Prismatic Panel to Optimize Window Size and Depth of a South-facing Room for a Better Daylight Performance；本基地法規：否；核對狀態：數值待原典交叉核對。",
      "library_id": "CIRCADIAN_DAYLIGHT20"
    }
  ],
  "design_implications_zh": [
    "分別標注臥室、起居室和整體翼深，先看深處是否由衛浴或儲藏等短時使用佔據。"
  ],
  "applies_when_zh": "「單面住宅房間的有效進深帶」可在用於方案前期的量體、平面或空間品質篩檢時使用，前提是單面採光住宅主要房間可先以約 5–7 m 的淨進深作平面測試，並依窗高與遮擋重新計算與來源情境相符。",
  "not_applicable_when_zh": "若單面採光住宅主要房間可先以約 5–7 m 的淨進深作平面測試，並依窗高與遮擋重新計算不成立，就不能把「單面住宅房間的有效進深帶」的結論延伸到其他情況；不得單獨作為許可、消防、結構或基地法規判定。",
  "debates_zh": "戶型規範、窗台高度與室內分隔會造成不同結果，不能只看平均進深。",
  "sources": [
    {
      "library_id": "CIRCADIAN_DAYLIGHT20",
      "claim_id": "C1",
      "locator": "article; abstract/title scope only"
    },
    {
      "library_id": "TIMESAVER_TYPES01",
      "claim_id": "C1",
      "locator": null
    }
  ],
  "source_count_flag": "MULTI_SOURCE",
  "claim_verification": "CANONICAL_CROSS_CHECKED_CLAUDE_20261008",
  "tradition": "建築設計與住宅類型學",
  "region": "跨地域；用途與當地法規需分開核驗",
  "curriculum_refs": [
    {
      "school": "TU Delft",
      "course": "Housing and the City / Design of the Urban Fabric",
      "topic": "建築尺度與住宅平面"
    },
    {
      "school": "Harvard GSD",
      "course": "Elements of Urban Design",
      "topic": "建築尺度與街道界面"
    },
    {
      "school": "MIT",
      "course": "Architecture and Urban Design",
      "topic": "建築尺度與空間型態"
    },
    {
      "school": "UCL Bartlett",
      "course": "Urban Design: Place Making",
      "topic": "建築尺度與公共生活"
    }
  ],
  "check": {
    "method_zh": "在平面與剖面量窗面到房間最深使用點，按各用途分別做 daylight check。",
    "inputs": [
      "住宅單元與類型",
      "尺寸／面積圖層",
      "適用地區與用途標籤"
    ],
    "logic_zh": "將量測輸入轉成明確尺寸、比例或空間關係；越界只觸發複核，不自動取代設計決策。",
    "limitations_zh": "量測結果只觸發「單面住宅房間的有效進深帶」的複核，不得單獨作為許可或法規判定。"
  },
  "version": "kb2-arc-draft-2026-10-08",
  "related_unit_ids": [
    "KU-ARC-001",
    "KU-ARC-002",
    "KU-ARC-003",
    "KU-ARC-004",
    "KU-ARC-005"
  ]
}
