{
  "id": "KU-HOU-058",
  "domain": "HOU",
  "subtopic": "老化與多世代居住",
  "type": "empirical_finding",
  "title_zh": "多數住宅尚未支援衰弱長者長期在地居住",
  "title_en": "Older adults and supportive neighborhoods",
  "summary_zh": "回顧不是介入成效試驗，不能宣稱特定模式已被證明有效。 將居住單元、公共領域、交通與日常支援連成方案。 研究設計：高齡住宅、都市設計與規劃文獻回顧；地區：美國為主要政策背景，並納入跨國案例。",
  "key_points_zh": [
    "文獻回顧指出，許多住宅與鄰里不利於衰弱長者在地老化，並整理全齡鄰里、集體服務和小規模跨世代模式。",
    "研究設計：高齡住宅、都市設計與規劃文獻回顧；地區：美國為主要政策背景，並納入跨國案例",
    "限制：回顧不是介入成效試驗，不能宣稱特定模式已被證明有效。"
  ],
  "evidence": {
    "strength": "MIXED",
    "findings": [
      {
        "claim_zh": "文獻回顧指出，許多住宅與鄰里不利於衰弱長者在地老化，並整理全齡鄰里、集體服務和小規模跨世代模式。",
        "effect_or_value": "回顧指出多種支持策略尚未廣泛普及",
        "study_design": "高齡住宅、都市設計與規劃文獻回顧",
        "context_region": "美國為主要政策背景，並納入跨國案例",
        "library_id": "FORSYTH2019",
        "locator": null,
        "claim_verification": "ABSTRACT_REVIEW"
      }
    ]
  },
  "design_implications_zh": [
    "將居住單元、公共領域、交通與日常支援連成方案。"
  ],
  "design_options": [
    {
      "option_zh": "將居住單元、公共領域、交通與日常支援連成方案。",
      "tradeoff_zh": "「多數住宅尚未支援衰弱長者長期在地居住」採用「將居住單元、公共領域、交通與日常支援連成方案」時，得失要沿著文獻回顧指出，許多住宅與鄰里不利於衰弱長者在地老化，並整理全齡鄰里、集體服務和小規模跨世代模式檢查；回顧不是介入成效試驗，不能宣稱特定模式已被證明有效。",
      "library_ids": [
        "FORSYTH2019",
        "MADDEN2016"
      ]
    },
    {
      "option_zh": "在「多數住宅尚未支援衰弱長者長期在地居住」的來源情境裡，在地老化、支持性住宅與小規模跨世代模式是不同策略；落到設計時還要按文獻回顧指出，許多住宅與鄰里不利於衰弱長者在地老化，並整理全齡鄰里、集體服務和小規模跨世代模式調整。",
      "tradeoff_zh": "「多數住宅尚未支援衰弱長者長期在地居住」採用「在「多數住宅尚未支援衰弱長者長期在地居住」的來源情境裡，在地老化、支持性住宅與小規模跨世代模式是不同策略；落到設計時還要按文獻回顧指出，許多住宅與鄰里不利於衰弱長者在地老化，並整理全齡鄰里、集體服務和小規模跨世代模式調整」時，得失要沿著文獻回顧指出，許多住宅與鄰里不利於衰弱長者在地老化，並整理全齡鄰里、集體服務和小規模跨世代模式檢查；回顧不是介入成效試驗，不能宣稱特定模式已被證明有效。",
      "library_ids": [
        "FORSYTH2019",
        "MADDEN2016"
      ]
    }
  ],
  "applies_when_zh": "用於與美國為主要政策背景，並納入跨國案例研究情境可比、且量測定義相近的分析。",
  "not_applicable_when_zh": "回顧不是介入成效試驗，不能宣稱特定模式已被證明有效。",
  "debates_zh": "回顧不是介入成效試驗，不能宣稱特定模式已被證明有效。",
  "sources": [
    {
      "library_id": "FORSYTH2019",
      "claim_id": "C1",
      "locator": null
    },
    {
      "library_id": "MADDEN2016",
      "claim_id": "C1",
      "locator": null
    }
  ],
  "source_count_flag": "MULTI_SOURCE",
  "tradition": "高齡住宅與全齡鄰里設計；住房權與政治經濟批判",
  "region": "美國為主要政策背景，含跨國設計文獻；美國與跨國住房政治",
  "curriculum_refs": [
    {
      "school": "TU Delft",
      "course": "Design of the Urban Fabric",
      "topic": "老化與多世代居住"
    },
    {
      "school": "Harvard GSD",
      "course": "Elements of Urban Design",
      "topic": "老化與多世代居住"
    },
    {
      "school": "MIT",
      "course": "11.301J Introduction to Urban Design and Development",
      "topic": "老化與多世代居住"
    },
    {
      "school": "UCL Bartlett",
      "course": "Urban Design: Place Making",
      "topic": "老化與多世代居住"
    }
  ],
  "version": "kb2-enrich-draft-2026-10-08",
  "related_unit_ids": [
    "KU-HOU-052",
    "KU-HOU-053",
    "KU-HOU-054"
  ],
  "counter_unit_ids": [
    "KU-HOU-056"
  ]
}
