{
  "id": "KU-HOU-002",
  "domain": "HOU",
  "subtopic": "住宅類型",
  "type": "typology",
  "title_zh": "住宅類型｜類型取捨",
  "title_en": "Housing typologies — Typology and trade-offs",
  "summary_zh": "住宅類型同時涉及戶型、入口、樓層、共同空間和服務安排，外觀分類不足以描述居住經驗。 特定住戶調查將整體滿意度與廚房、清潔和大眾運輸可及性聯繫，並報告不同住戶特徵間的差異。 這些結果屬特定樣本，不能單靠建築高度替類型排序。",
  "key_points_zh": [
    "高層、連棟、集合式住宅和共居住宅各有不同支援與管理需求。",
    "讀「住宅類型｜類型取捨」時，適用於新住宅、社會住宅和高密度更新；同時把受訪住戶整體滿意；廚房、清潔與大眾運輸可及性是較強預測因子，居住時間較短者與 studio 住戶滿意度較高列為核對條件。",
    "限制：不從建築高度直接推斷住戶滿意或社區形成。"
  ],
  "evidence": {
    "strength": "THEORETICAL",
    "findings": [
      {
        "claim_zh": "受訪住戶整體滿意；廚房、清潔與大眾運輸可及性是較強預測因子，居住時間較短者與 studio 住戶滿意度較高。",
        "library_id": "GONG2023",
        "effect_or_value": null,
        "study_design": null,
        "context_region": "斯德哥爾摩，瑞典",
        "locator": null,
        "claim_verification": "ABSTRACT_REVIEW"
      },
      {
        "claim_zh": "住宅內部條件、社區環境與設施可及性與滿意度相關；年齡、性別、語言及家中有孩童或長者會調節關係。",
        "library_id": "KSHETRIMAYUM2020",
        "effect_or_value": null,
        "study_design": null,
        "context_region": "孟買，印度",
        "locator": null,
        "claim_verification": "ABSTRACT_REVIEW"
      }
    ]
  },
  "design_implications_zh": [
    "以住戶、公共空間和服務路徑三層對照住宅類型。"
  ],
  "design_options": [
    {
      "option_zh": "在「住宅類型｜類型取捨」的來源情境裡，以住戶、公共空間和服務路徑三層對照住宅類型；落到設計時還要按受訪住戶整體滿意；廚房、清潔與大眾運輸可及性是較強預測因子，居住時間較短者與 studio 住戶滿意度較高調整。",
      "tradeoff_zh": "增加空間選擇與公共連結，但會增加協調、管理或建造成本。",
      "library_ids": [
        "GONG2023",
        "KSHETRIMAYUM2020"
      ]
    },
    {
      "option_zh": "在「住宅類型｜類型取捨」的來源情境裡，高層、連棟、集合式住宅和共居住宅各有不同支援與管理需求；落到設計時還要按受訪住戶整體滿意；廚房、清潔與大眾運輸可及性是較強預測因子，居住時間較短者與 studio 住戶滿意度較高調整。",
      "tradeoff_zh": "保留另一種形式和使用條件，但可能改變連續性、可達性或私密性。",
      "library_ids": [
        "GONG2023",
        "KSHETRIMAYUM2020"
      ]
    }
  ],
  "applies_when_zh": "適用於新住宅、社會住宅和高密度更新。",
  "not_applicable_when_zh": "不從建築高度直接推斷住戶滿意或社區形成。",
  "debates_zh": "外觀類型不能替代戶型適用性、產權或服務分析。",
  "sources": [
    {
      "library_id": "GONG2023",
      "claim_id": "C1",
      "locator": null
    },
    {
      "library_id": "KSHETRIMAYUM2020",
      "claim_id": "C1",
      "locator": null
    }
  ],
  "source_count_flag": "MULTI_SOURCE",
  "tradition": "瑞典學生住宅與居住滿意；孟買安置住宅與居住滿意",
  "region": "斯德哥爾摩，瑞典；孟買，印度",
  "curriculum_refs": [
    {
      "school": "TU Delft",
      "course": "Design of the Urban Fabric",
      "topic": "住宅類型"
    },
    {
      "school": "Harvard GSD",
      "course": "Elements of Urban Design",
      "topic": "住宅類型"
    },
    {
      "school": "MIT",
      "course": "11.301J Introduction to Urban Design and Development",
      "topic": "住宅類型"
    },
    {
      "school": "UCL Bartlett",
      "course": "Urban Design: Place Making",
      "topic": "住宅類型"
    }
  ],
  "version": "kb2-enrich-draft-2026-10-08",
  "related_unit_ids": [
    "KU-HOU-001",
    "KU-HOU-003",
    "KU-HOU-004"
  ],
  "counter_unit_ids": [
    "KU-HOU-005"
  ]
}
