{
  "id": "KU-LUP-024",
  "domain": "LUP",
  "subtopic": "混合使用尺度：建築、街廓、街區",
  "type": "empirical_finding",
  "title_zh": "不同住宅型態住戶對用途多樣性的估值不同",
  "title_en": "Housing type and mixed-use value",
  "summary_zh": "估值是偏好市場表現，不代表社會公平、健康或活動品質。 在混合用途方案中將戶型和價格分布分開檢視。 研究設計：半參數住宅價格分析；地區：荷蘭住宅市場。 限制：估值是偏好市場表現，不代表社會公平、健康或活動品質。",
  "key_points_zh": [
    "荷蘭資料顯示多樣性估值存在異質性，公寓住戶較可能為用途多樣性付費，其他住宅型態未呈相同意願。",
    "研究設計：半參數住宅價格分析；地區：荷蘭住宅市場",
    "限制：估值是偏好市場表現，不代表社會公平、健康或活動品質。"
  ],
  "evidence": {
    "strength": "MIXED",
    "findings": [
      {
        "claim_zh": "荷蘭資料顯示多樣性估值存在異質性，公寓住戶較可能為用途多樣性付費，其他住宅型態未呈相同意願。",
        "effect_or_value": "荷蘭；公寓住戶呈現正向支付意願，並非所有戶型皆如此",
        "study_design": "半參數住宅價格分析",
        "context_region": "荷蘭住宅市場",
        "library_id": "KOSTER2012",
        "locator": null,
        "claim_verification": "ABSTRACT_REVIEW"
      }
    ]
  },
  "design_implications_zh": [
    "在混合用途方案中將戶型和價格分布分開檢視。"
  ],
  "design_options": [
    {
      "option_zh": "在混合用途方案中將戶型和價格分布分開檢視。",
      "tradeoff_zh": "「不同住宅型態住戶對用途多樣性的估值不同」的主要代價不是抽象的建造成本，而是估值是偏好市場表現，不代表社會公平、健康或活動品質；因此先以荷蘭資料顯示多樣性估值存在異質性，公寓住戶較可能為用途多樣性付費，其他住宅型態未呈相同意願作方案比較條件。",
      "library_ids": [
        "KOSTER2012",
        "CERVERO97"
      ]
    },
    {
      "option_zh": "在「不同住宅型態住戶對用途多樣性的估值不同」的來源情境裡，樓層混用可縮短活動距離；街區混用較易分隔噪音與裝卸；落到設計時還要按荷蘭資料顯示多樣性估值存在異質性，公寓住戶較可能為用途多樣性付費，其他住宅型態未呈相同意願調整。",
      "tradeoff_zh": "「不同住宅型態住戶對用途多樣性的估值不同」的主要代價不是抽象的建造成本，而是估值是偏好市場表現，不代表社會公平、健康或活動品質；因此先以荷蘭資料顯示多樣性估值存在異質性，公寓住戶較可能為用途多樣性付費，其他住宅型態未呈相同意願作方案比較條件。",
      "library_ids": [
        "KOSTER2012",
        "CERVERO97"
      ]
    }
  ],
  "applies_when_zh": "用於與荷蘭住宅市場研究情境可比、且量測定義相近的分析。",
  "not_applicable_when_zh": "估值是偏好市場表現，不代表社會公平、健康或活動品質。",
  "debates_zh": "估值是偏好市場表現，不代表社會公平、健康或活動品質。",
  "sources": [
    {
      "library_id": "KOSTER2012",
      "claim_id": "C1",
      "locator": null
    },
    {
      "library_id": "CERVERO97",
      "claim_id": "C1",
      "locator": null
    }
  ],
  "source_count_flag": "MULTI_SOURCE",
  "tradition": "土地經濟與用途混合；建成環境交通實證",
  "region": "荷蘭住宅市場；美國",
  "curriculum_refs": [
    {
      "school": "TU Delft",
      "course": "Planning Complex Cities",
      "topic": "混合使用尺度：建築、街廓、街區"
    },
    {
      "school": "Harvard GSD",
      "course": "Cities by Design",
      "topic": "混合使用尺度：建築、街廓、街區"
    },
    {
      "school": "MIT",
      "course": "11.301J Introduction to Urban Design and Development",
      "topic": "混合使用尺度：建築、街廓、街區"
    },
    {
      "school": "UCL Bartlett",
      "course": "Sustainable Futures by Design",
      "topic": "混合使用尺度：建築、街廓、街區"
    }
  ],
  "version": "kb2-enrich-draft-2026-10-08",
  "related_unit_ids": [
    "KU-LUP-018",
    "KU-LUP-019",
    "KU-LUP-020"
  ],
  "counter_unit_ids": [
    "KU-LUP-022"
  ]
}
