{
  "id": "KU-ARC-008",
  "domain": "ARC",
  "subtopic": "住宅單元與類型",
  "type": "value_range",
  "title_zh": "單人臥室的面積與淨寬",
  "title_en": "single bedroom minimum area and width",
  "summary_zh": "NDSS 將單人床位臥室定為至少 7.5 m²，且至少 2.15 m 寬。 這是房間最低尺寸條件，並未自動包含走道、衣櫃門片與桌面配置。 平面審查應以淨尺寸測量，不用結構軸線代替。",
  "key_points_zh": [
    "核心主張：NDSS 將單人床位臥室定為至少 7.5 m²，且至少 2.15 m 寬。",
    "量測檢查：讀取室內完成面之間的最小淨寬與可用地板面積，再按當地採用標準比較。"
  ],
  "evidence": {
    "strength": "NORMATIVE_PRACTICE",
    "findings": [
      {
        "claim_zh": "NDSS 將單人床位臥室定為至少 7.5 m²，且至少 2.15 m 寬。",
        "effect_or_value": "≥7.5 m²；淨寬 ≥2.15 m",
        "study_design": "跨地域設計參照綜整；數值狀態依 claim_verification 註記",
        "context_region": "England；臥室",
        "library_id": "UK_NDSS_2015",
        "locator": "technical requirements paras 10–11; Table 1",
        "claim_verification": "ABSTRACT_REVIEW"
      }
    ]
  },
  "values": [
    {
      "name": "single bedroom minimum",
      "range": "≥7.5 m²；淨寬 ≥2.15 m",
      "unit": "m²；m",
      "context": "地區：England；用途：英格蘭新建住宅單人床位臥室；出處：Technical housing standards – nationally described space standard；本基地法規：否；核對狀態：官方頁面直接讀取。",
      "library_id": "UK_NDSS_2015"
    }
  ],
  "design_implications_zh": [
    "將床、衣櫃與開門弧線放入淨尺寸框內，避免面積達標但家具互相卡住。"
  ],
  "applies_when_zh": "「單人臥室的面積與淨寬」可在用於方案前期的量體、平面或空間品質篩檢時使用，前提是NDSS 將單人床位臥室定為至少 7.5 m²，且至少 2.15 m 寬與來源情境相符。",
  "not_applicable_when_zh": "若NDSS 將單人床位臥室定為至少 7.5 m²，且至少 2.15 m 寬不成立，就不能把「單人臥室的面積與淨寬」的結論延伸到其他情況；不得單獨作為許可、消防、結構或基地法規判定。",
  "debates_zh": "英格蘭最低值不代表所有年齡、照護或無障礙需求都適用。",
  "sources": [
    {
      "library_id": "UK_NDSS_2015",
      "claim_id": "C1",
      "locator": "technical requirements paras 10–11; Table 1"
    },
    {
      "library_id": "COURTYARD_HEALTH15",
      "claim_id": "C1",
      "locator": null
    }
  ],
  "source_count_flag": "MULTI_SOURCE",
  "claim_verification": "ABSTRACT_REVIEW",
  "tradition": "建築設計與住宅類型學",
  "region": "England；臥室",
  "curriculum_refs": [
    {
      "school": "TU Delft",
      "course": "Housing and the City / Design of the Urban Fabric",
      "topic": "建築尺度與住宅平面"
    },
    {
      "school": "Harvard GSD",
      "course": "Elements of Urban Design",
      "topic": "建築尺度與街道界面"
    },
    {
      "school": "MIT",
      "course": "Architecture and Urban Design",
      "topic": "建築尺度與空間型態"
    },
    {
      "school": "UCL Bartlett",
      "course": "Urban Design: Place Making",
      "topic": "建築尺度與公共生活"
    }
  ],
  "check": {
    "method_zh": "讀取室內完成面之間的最小淨寬與可用地板面積，再按當地採用標準比較。",
    "inputs": [
      "住宅單元與類型",
      "尺寸／面積圖層",
      "適用地區與用途標籤"
    ],
    "logic_zh": "將量測輸入轉成明確尺寸、比例或空間關係；越界只觸發複核，不自動取代設計決策。",
    "limitations_zh": "量測結果只觸發「單人臥室的面積與淨寬」的複核，不得單獨作為許可或法規判定。"
  },
  "version": "kb2-arc-draft-2026-10-08",
  "related_unit_ids": [
    "KU-ARC-001",
    "KU-ARC-002",
    "KU-ARC-003",
    "KU-ARC-004",
    "KU-ARC-005"
  ]
}
