{
  "id": "KU-ARC-033",
  "domain": "ARC",
  "subtopic": "用途建築",
  "type": "value_range",
  "title_zh": "街邊商店的立面模組面寬",
  "title_en": "retail frontage module",
  "summary_zh": "連續店面可用約 6–9 m 模組試排，讓出入口與櫥窗形成可辨識的小尺度節奏。 將多個模組合併成單一大面時，街牆可能失去細節與可替換性。 立面節奏仍須對應內部柱網及實際租賃需求。",
  "key_points_zh": [
    "核心主張：連續店面可用約 6–9 m 模組試排，讓出入口與櫥窗形成可辨識的小尺度節奏。",
    "量測檢查：以外牆分格和租戶分界疊圖，計算相鄰入口間距與無入口長度。"
  ],
  "evidence": {
    "strength": "NORMATIVE_PRACTICE",
    "findings": [
      {
        "claim_zh": "連續店面可用約 6–9 m 模組試排，讓出入口與櫥窗形成可辨識的小尺度節奏。",
        "effect_or_value": "約 6–9 m／店面作街牆節奏測試",
        "study_design": "跨地域設計參照綜整；數值狀態依 claim_verification 註記",
        "context_region": "跨地域；用途與當地法規需分開核驗",
        "library_id": "METRIC_HB08",
        "locator": null,
        "claim_verification": "CANONICAL_CROSS_CHECKED_CLAUDE_20261008"
      }
    ]
  },
  "values": [
    {
      "name": "retail frontage module",
      "range": "約 6–9 m／店面作街牆節奏測試",
      "unit": "m／單元",
      "context": "地區：跨地域；用途：街邊零售立面模組初篩；非基地法規；出處：Metric Handbook: Planning and Design Data；本基地法規：否；核對狀態：數值待原典交叉核對。",
      "library_id": "METRIC_HB08"
    }
  ],
  "design_implications_zh": [
    "沿街量每個獨立入口中心距，統計單一營業單元的 frontage，不把整棟寬度當成單店面寬。"
  ],
  "applies_when_zh": "「街邊商店的立面模組面寬」可在用於方案前期的量體、平面或空間品質篩檢時使用，前提是連續店面可用約 6–9 m 模組試排，讓出入口與櫥窗形成可辨識的小尺度節奏與來源情境相符。",
  "not_applicable_when_zh": "若連續店面可用約 6–9 m 模組試排，讓出入口與櫥窗形成可辨識的小尺度節奏不成立，就不能把「街邊商店的立面模組面寬」的結論延伸到其他情況；不得單獨作為許可、消防、結構或基地法規判定。",
  "debates_zh": "短面寬增加分戶彈性，但過多門口也可能擠壓無障礙或裝卸空間。",
  "sources": [
    {
      "library_id": "METRIC_HB08",
      "claim_id": "C1",
      "locator": null
    },
    {
      "library_id": "TSUI2020",
      "claim_id": "C1",
      "locator": null
    }
  ],
  "source_count_flag": "MULTI_SOURCE",
  "claim_verification": "CANONICAL_CROSS_CHECKED_CLAUDE_20261008",
  "tradition": "建築設計與住宅類型學",
  "region": "跨地域；用途與當地法規需分開核驗",
  "curriculum_refs": [
    {
      "school": "TU Delft",
      "course": "Housing and the City / Design of the Urban Fabric",
      "topic": "建築尺度與住宅平面"
    },
    {
      "school": "Harvard GSD",
      "course": "Elements of Urban Design",
      "topic": "建築尺度與街道界面"
    },
    {
      "school": "MIT",
      "course": "Architecture and Urban Design",
      "topic": "建築尺度與空間型態"
    },
    {
      "school": "UCL Bartlett",
      "course": "Urban Design: Place Making",
      "topic": "建築尺度與公共生活"
    }
  ],
  "check": {
    "method_zh": "以外牆分格和租戶分界疊圖，計算相鄰入口間距與無入口長度。",
    "inputs": [
      "用途建築",
      "尺寸／面積圖層",
      "適用地區與用途標籤"
    ],
    "logic_zh": "將量測輸入轉成明確尺寸、比例或空間關係；越界只觸發複核，不自動取代設計決策。",
    "limitations_zh": "量測結果只觸發「街邊商店的立面模組面寬」的複核，不得單獨作為許可或法規判定。"
  },
  "version": "kb2-arc-draft-2026-10-08",
  "related_unit_ids": [
    "KU-ARC-027",
    "KU-ARC-028",
    "KU-ARC-029",
    "KU-ARC-030",
    "KU-ARC-031"
  ]
}
